<?xml version="1.0" encoding="UTF-8"?>
<candidate xmlns:xsi="http://www.w3.org/2001/XMLSchema-instance" xsi:noNamespaceSchemaLocation="candidate_final.xsd">
  <registration_number>15497</registration_number>
  <registration_date>2018-01-14</registration_date>
 <position>cargo1</position> 
  <port_teste>
    <pq1>A</pq1>
    <pq2>B</pq2>
    <pq3>B</pq3>
    <pq4>B</pq4>
    <pq5>B</pq5>
    <pq6>B</pq6>
    <pq7>E</pq7>
    <pq8>B</pq8>
    <pq9>B</pq9>
    <pq10>A</pq10>
    <pq11>C</pq11>
    <pq12>E</pq12>
    <pq13>N</pq13>
    <pq14>N</pq14>
    <pq15>A</pq15>
  </port_teste>
  <math_teste>
    <mq1>A</mq1>
    <mq2>B</mq2>
    <mq3>B</mq3>
    <mq4>B</mq4>
    <mq5>B</mq5>
    <mq6>B</mq6>
    <mq7>E</mq7>
    <mq8>B</mq8>
    <mq9>B</mq9>
    <mq10>A</mq10>
    <mq11>C</mq11>
    <mq12>E</mq12>
    <mq13>N</mq13>
    <mq14>N</mq14>
    <mq15>A</mq15>
  </math_teste>
  <spec_teste>
    <sq1>A</sq1>
    <sq2>B</sq2>
    <sq3>B</sq3>
    <sq4>B</sq4>
    <sq5>B</sq5>
    <sq6>B</sq6>
    <sq7>E</sq7>
    <sq8>B</sq8>
    <sq9>B</sq9>
    <sq10>A</sq10>
    <sq11>C</sq11>
    <sq12>E</sq12>
    <sq13>N</sq13>
    <sq14>N</sq14>
    <sq15>A</sq15>
    <sq16>D</sq16>
    <sq17>D</sq17>
    <sq18>E</sq18>
    <sq19>B</sq19>
    <sq20>A</sq20>
  </spec_teste>
  <port_count>0</port_count>
  <math_count>0</math_count>
  <spec_count>0</spec_count>
  <final_count>0.0</final_count>
</candidate>
